Indicator Name,2000,2001,2002,2003,2004,2005,2006,2007,2008,2009,2010,2011,2012,2013,2014
"Agricultural machinery, tractors",2091000,,,,,,,,,,,,,,
Fertilizer consumption (% of fertilizer production),,,113.401275,119.9610551,121.4863244,132.8960089,152.5510538,172.230339,188.9650179,181.2310086,181.4846733,170.4998305,160.6461928,,
Fertilizer consumption (kilograms per hectare of arable land),,,100.3290553,105.1772039,115.2715101,127.614592,136.4039215,142.8352255,153.3493908,167.4572959,179.0986262,177.935847,163.6706402,,
Agricultural land (sq. km),1809750,1804870,1800370,1803090,1800830,1798580,1799730,1797090,1797080,1799630,1797590,1797990,1793000,,
Agricultural land (% of land area),60.86896566,60.70483218,60.5534796,60.64496383,60.56895119,60.4932749,60.53195389,60.44316038,60.44282404,60.5285905,60.45997733,60.47343089,60.30559769,,
Arable land (hectares),160930000,160325000,159934000,159865000,159450000,159213000,158720000,158104000,157920000,157823000,157510000,157350000,156200000,,
Arable land (hectares per person),0.154404591,0.151321251,0.148540123,0.146157373,0.143567668,0.141253526,0.138827498,0.13640294,0.134438634,0.132608984,0.130645969,0.128853282,0.126305228,,
Arable land (% of land area),54.12704873,53.92356358,53.792055,53.7688476,53.62926688,53.54955452,53.38373935,53.17655448,53.11466808,53.08204319,52.97676906,52.92295481,52.53616486,,
Land under cereal production (hectares),102402400,100271100,94470900,98603100,97805700,99519200,99236800,100833500,101155500,97171600,100075800,100585700,97100000,98820000,
Permanent cropland (% of land area),3.094319569,3.195221294,3.228855203,3.363390836,3.434022044,3.440748825,3.632462103,3.760270955,3.834265553,3.968801187,4.069702912,4.136970728,4.30514027,,
Land area where elevation is below 5 meters (% of total land area),1.353457,,,,,,,,,,,,,,
Forest area (sq. km),653900,658538,663176,667814,672452,677090,678540,679990,681440,682890,684340,685790,687240,,
Forest area (% of land area),21.99321268,22.14920674,22.30520081,22.46119488,22.61718895,22.77318301,22.82195218,22.87072135,22.91949051,22.96825968,23.01702885,23.06579801,23.11456718,,
Agricultural irrigated land (% of total agricultural land),,32.20730579,31.61683432,29.87704441,31.62930427,32.91819102,33.56670167,34.33717844,34.65955884,35.1161072,35.18933683,,,,
Average precipitation in depth (mm per year),,,1083,,,,,1083,,,,,1083,,1083
Land area (sq. km),2973190,2973190,2973190,2973190,2973190,2973190,2973190,2973190,2973190,2973190,2973190,2973190,2973190,2973190,2973190
"Agricultural machinery, tractors per 100 sq. km of arable land",128.5053191,,,,,,,,,,,,,,
Cereal production (metric tons),234931192,242963796,206636704,236592700,229845500,239997500,242785600,260485900,266835300,250783400,267838300,287860000,293290000,293940000,
Crop production index (2004-2006 = 100),92.28,95,84.73,97.13,94.05,99.89,106.06,116.42,117.5,112.94,125.15,134.36,131.18,,
Food production index (2004-2006 = 100),91.67,94.81,87.36,96.49,94.68,100.02,105.3,114.62,117.06,114.41,123.59,130.61,130,,
Livestock production index (2004-2006 = 100),84.53,87.78,89.47,91.56,95.79,99.81,104.39,111.06,114.26,118.8,124.37,126.33,127.91,,
Surface area (sq. km),3287260,3287260,3287260,3287260,3287260,3287260,3287260,3287260,3287260,3287260,3287260,3287260,3287260,3287260,3287260
Cereal yield (kg per hectare),2294.2,2423.1,2187.3,2399.4,2350,2411.6,2446.5,2583.3,2637.9,2580.8,2676.4,2861.8,3020.5,2974.5,
Trade in services (% of GDP),,,,,,11.90883776,13.4813773,12.65256213,15.83151018,12.68803622,13.56819313,14.01888092,14.80483008,14.64756022,
"Communications, computer, etc. (% of service imports, BoP)",,,,,,35.81809198,37.40792063,34.57482505,30.85066633,34.32977175,32.61837205,26.76758672,30.87486348,30.98666958,
"Primary income payments (BoP, current US$)",,,,,,12295901918,14444753970,19165591221,20957686735,21271739133,25563053870,26190542392,30741858254,33013233326,
"Imports of goods and services (BoP, current US$)",,,,,,1.82E+11,2.25E+11,2.79E+11,3.79E+11,3.28E+11,4.39E+11,5.53E+11,5.80E+11,5.60E+11,
"Insurance and financial services (% of service imports, BoP)",,,,,,6.782522727,7.8974445,9.156928689,8.978289683,9.68055216,10.27833469,11.58543826,9.068207696,9.368046357,
"Goods imports (BoP, current US$)",,,,,,1.35E+11,1.67E+11,2.09E+11,2.92E+11,2.48E+11,3.24E+11,4.28E+11,4.50E+11,4.34E+11,
"Service imports (BoP, current US$)",,,,,,47166360582,58514164307,70174852290,87739052164,80349462739,1.15E+11,1.25E+11,1.30E+11,1.26E+11,
"Charges for the use of intellectual property, payments (BoP, current US$)",,,,,,671829366.3,845949436,1159824391,1528826913,1860070100,2438302981,2819291079,3990055617,3903908830,
"Imports of goods, services and primary income (BoP, current US$)",,,,,,1.94E+11,2.40E+11,2.98E+11,4.00E+11,3.50E+11,4.65E+11,5.79E+11,6.11E+11,5.93E+11,
"Transport services (% of service imports, BoP)",,,,,,44.28276442,42.99667644,44.55616224,49.22267186,44.40335183,40.55691672,46.32917794,46.63872364,45.26066938,
"Travel services (% of service imports, BoP)",,,,,,13.11662087,11.69795843,11.71208402,10.94837213,11.58632425,9.142164065,10.95578431,9.518537583,9.164302833,
"Foreign direct investment, net outflows (% of GDP)",,,,,,0.316555674,1.478936394,1.374514349,1.573120933,1.178842003,0.934649321,0.67060229,0.460162038,0.094040464,
"Secondary income, other sectors, payments (BoP, current US$)",,,,,,475507398,857016412.5,1233747716,2894628689,1652988824,2270102083,2522897385,3135735444,4156511171,
"Personal remittances, paid (current US$)",486141906.7,751084716.8,1186800171,1265419800,1652783203,1348282858,1561865362,2059330846,3812363581,2889988305,3828678498,4077745356,4963082154,6412841564,
"Current account balance (BoP, current US$)",,,,,,-10283543308,-9299060317,-8075694484,-30971987181,-26186435957,-54515877624,-62517637222,-91471245846,-49225968929,
Current account balance (% of GDP),,,,,,-1.232720958,-0.979759353,-0.651949076,-2.530190453,-1.917896928,-3.190938826,-3.325229112,-4.921130052,-2.622870971,
"Net financial account (BoP, current US$)",,,,,,-10824559421,-8399404999,-6737296326,-29826228672,-26172856384,-56436079497,-64390527321,-90237732678,-48095285548,
"Net primary income (BoP, current US$)",,,,,,-6649958332,-6245325788,-6515811031,-5364336274,-7538933229,-15601985068,-16043262742,-20842871438,-21783481693,
"Net trade in goods and services (BoP, current US$)",,,,,,-27276336271,-31769964257,-38703712439,-74360043516,-67410018791,-91023662479,-1.07E+11,-1.36E+11,-92257279931,
"Net trade in goods (BoP, current US$)",,,,,,-32288927608,-42695648388,-55081319693,-92675230456,-79950042234,-93353427193,-1.20E+11,-1.52E+11,-1.15E+11,
"Net errors and omissions (BoP, current US$)",,,,,,-541016113.4,899655318.5,1338398158,1145758509,-279420427.5,-1969864183,-1940805909,1830745984,168853716.8,
"Foreign direct investment, net (BoP, current US$)",,,,,,-4628652265,-5992285935,-8201628958,-24149749830,-19485789183,-11428785746,-23890659988,-15442447343,-26388082470,
"Portfolio Investment, net (BoP, current US$)",,,,,,-12144114068,-9545718947,-33016300605,15074790314,-17756860244,-36875471079,-2664809742,-29285240146,-6857994918,
"Reserves and related items (BoP, current US$)",,,,,,14554075998,29169924815,87488219956,25372728203,17035954559,14126806367,-4138567645,-4022754897,10928508988,
"Net secondary income (BoP, current US$)",13434458436,14732958218,16090810168,21831498410,19792616190,23642751295,28716229728,37143828986,48752392609,48762516063,52109769922,60212408129,65435024619,64814792695,
"Net capital account (BoP, current US$)",,,,,,,,,,293000000,49662310.11,67915809.28,-597232816.4,961829664.6,
"Grants, excluding technical cooperation (BoP, current US$)",460590000,557160000,697950000,620830000,893420000,1091860000,892500000,1144310000,1173000000,1225900000,1000650000,1027040000,812580000,,
"Technical cooperation grants (BoP, current US$)",286860000,313940000,327970000,418440000,387080000,352370000,358350000,276030000,276290000,266040000,282300000,325750000,354720000,,
"ICT service exports (BoP, current US$)",,,,,,35073974538,47423914835,58985122161,73484592821,61624368553,75037123007,85662135486,95891807671,99193923195,
"ICT service exports (% of service exports, BoP)",,,,,,67.21862599,68.29495729,68.14956209,69.289789,66.34159697,64.09704019,61.83741589,65.89370051,66.7302997,
"Communications, computer, etc. (% of service exports, BoP)",,,,,,69.11783817,70.1099552,70.1629611,71.25240126,70.39496354,65.90259538,63.33759977,67.70722234,69.16075218,
"Primary income receipts (BoP, current US$)",,,,,,5645943586,8199428181,12649780190,15593350461,13732805904,9961068802,10147279650,9898986816,11229751633,
"Exports of goods and services (BoP, current US$)",,,,,,1.55E+11,1.93E+11,2.40E+11,3.05E+11,2.61E+11,3.48E+11,4.46E+11,4.44E+11,4.68E+11,
"Insurance and financial services (% of service exports, BoP)",,,,,,3.994125632,4.997356311,5.643358199,5.517803887,5.524417524,6.50443995,6.376214052,5.228895452,5.731572903,
"Goods exports (BoP, current US$)",,,,,,1.02E+11,1.24E+11,1.54E+11,1.99E+11,1.68E+11,2.31E+11,3.08E+11,2.98E+11,3.19E+11,
"Service exports (BoP, current US$)",,,,,,52178951919,69439848438,86552459544,1.06E+11,92889486182,1.17E+11,1.39E+11,1.46E+11,1.49E+11,
"Charges for the use of intellectual property, receipts (BoP, current US$)",,,,,,205974583.7,60913260.31,163126496.6,147815443.4,191939516.6,127378163.3,302615975.5,321445174,445568319.5,
"Exports of goods, services and primary income (BoP, current US$)",,,,,,1.60E+11,2.02E+11,2.53E+11,3.21E+11,2.75E+11,3.58E+11,4.57E+11,4.54E+11,4.79E+11,
"Transport services (% of service exports, BoP)",,,,,,12.52811834,12.4590655,11.79719297,12.0733641,12.09230363,11.33966982,12.77826613,12.03004474,11.37965412,
"Travel services (% of service exports, BoP)",,,,,,14.35991785,12.43362299,12.39648773,11.15665622,11.98831531,12.37716152,12.78262381,12.34942584,12.37617321,
"Foreign direct investment, net inflows (BoP, current US$)",3584217307,5471947158,5626039508,4322747673,5771297153,7269407226,20029119267,25227740887,43406277076,35581372930,27396885034,36498654598,23995685014,28153031270,
"Foreign direct investment, net inflows (% of GDP)",0.752024446,1.107784016,1.073736082,0.699070504,0.799807686,0.871406904,2.110290315,2.036630088,3.545983252,2.605982958,1.603602253,1.941314391,1.290961827,1.500057187,
"Primary income on FDI, payments (current US$)",0,2143240331,2323415258,2413012643,3479235563,5244341660,7737524083,10909992105,11988871923,12278774182,21763448889,23759933902,16389049089,12554794807,
"Portfolio equity, net inflows (BoP, current US$)",2481311864,2949583339,1063391576,8216187274,9053979533,12151206548,9509114658,32862817217,-15030005085,24688929528,30442226311,-4048294106,22809104593,19891607287,
"Secondary income receipts (BoP, current US$)",,,,,,24512007176,30015197182,38885426199,52065208183,50526404973,54379872006,62735305514,68611473093,69441152030,
"Personal transfers, receipts (BoP, current US$)",,,,,,21859147408,28024797011,36769757385,49179627878,48331658602,52489564633,60259412355,65961872968,66799009274,
"Personal remittances, received (current US$)",12883465820,14273018550,15735736330,20999150390,18750376950,22125089480,28333642280,37216755275,49977276916,49203912009,53479960083,62499075445,68820517838,69970360847,
"Personal remittances, received (% of GDP)",2.703151182,2.889542123,3.003183297,3.395961957,2.598496525,2.652204662,2.985264109,3.004500638,4.082787073,3.603698947,3.130304206,3.324241836,3.702526574,3.728179096,
S&P Global Equity Indices (annual % change),-31.08166313,-19.91509628,6.829999924,76.51999664,20.09000015,33.56282272,46.70103093,78.58046381,-64.13702188,94.13996825,18.72242586,-38.04853051,23.33122262,-6.335899385,
Market capitalization of listed companies (current US$),1.48E+11,1.10E+11,1.31E+11,2.79E+11,3.88E+11,5.53E+11,8.19E+11,1.82E+12,6.45E+11,1.18E+12,1.62E+12,1.02E+12,1.26E+12,,
Market capitalization of listed companies (% of GDP),31.06609065,22.34937167,25.00358409,45.13461809,53.74984695,66.29873555,86.27796876,146.8555996,52.7309352,86.36728359,94.57997625,54.00616583,67.96713245,,
"Listed domestic companies, total",5937,5795,5650,5644,4730,4763,4796,4887,4921,4955,4987,5112,5191,,
"Stocks traded, total value (current US$)",5.10E+11,2.49E+11,1.97E+11,2.85E+11,3.79E+11,4.34E+11,6.38E+11,1.11E+12,1.05E+12,1.09E+12,1.06E+12,7.40E+11,6.22E+11,,
"Stocks traded, total value (% of GDP)",106.9664639,50.46991652,37.62015402,46.05784123,52.53497239,52.01298009,67.27138751,89.41228345,85.75696131,79.75030476,61.85739045,39.36903572,33.48919643,,
"Stocks traded, turnover ratio (%)",306.4985616,192.9109363,163.3076907,138.8924827,113.6781516,92.22839492,93.07668278,83.96958555,85.18685682,119.3490404,75.61875695,56.2609347,54.63441212,,
"Net bilateral aid flows from DAC donors, Australia (current US$)",10410000,11240000,7550000,7980000,12220000,12780000,980000,5780000,8270000,9580000,16450000,24330000,27770000,,
"Net bilateral aid flows from DAC donors, Austria (current US$)",750000,-340000,570000,-30040000,2420000,8010000,1720000,2560000,2440000,2340000,2150000,1990000,2320000,,
"Net bilateral aid flows from DAC donors, Belgium (current US$)",-1320000,5560000,-5060000,3820000,-19940000,690000,4520000,5310000,17520000,12060000,7170000,5370000,7120000,,
"Net bilateral aid flows from DAC donors, Canada (current US$)",6790000,13400000,16030000,-281450000,33560000,34010000,25460000,21430000,13280000,11540000,7910000,10780000,8900000,,
"Net bilateral aid flows from DAC donors, European Union institutions (current US$)",59670000,83770000,97300000,61230000,140400000,187800000,209740000,89620000,122310000,98910000,94260000,84840000,92580000,,
"Net bilateral aid flows from DAC donors, Switzerland (current US$)",18320000,22050000,23610000,24580000,28760000,24630000,20320000,17000000,14650000,12080000,10420000,11100000,10700000,,
"Net bilateral aid flows from DAC donors, Czech Republic (current US$)",,,,,,1310000,220000,170000,220000,120000,180000,110000,60000,,
"Net bilateral aid flows from DAC donors, Germany (current US$)",15630000,57500000,-26100000,3520000,-10720000,-68810000,55700000,127970000,147690000,263380000,396930000,496900000,171260000,,
"Net bilateral aid flows from DAC donors, Denmark (current US$)",20850000,19030000,8490000,-64140000,950000,6220000,-8540000,-230000,8590000,7370000,10140000,4240000,-130000,,
"Net bilateral aid flows from DAC donors, Spain (current US$)",-1030000,1190000,-290000,-21310000,9450000,11240000,8910000,12620000,14040000,25340000,11410000,7830000,5680000,,
"Net bilateral aid flows from DAC donors, Finland (current US$)",1080000,2080000,2540000,2420000,-3370000,5780000,3910000,3990000,4320000,7730000,6120000,1360000,4400000,,
"Net bilateral aid flows from DAC donors, France (current US$)",-11620000,-8890000,-135890000,-15360000,-13040000,-13980000,4280000,-48000000,-27170000,-29010000,2830000,75970000,-14550000,,
"Net bilateral aid flows from DAC donors, United Kingdom (current US$)",204160000,173880000,343720000,329880000,370150000,579240000,349300000,510530000,613120000,630340000,650340000,453850000,462860000,,
"Net bilateral aid flows from DAC donors, Greece (current US$)",120000,1230000,20000,180000,10000,10000,40000,140000,170000,160000,100000,210000,180000,,
"Net bilateral aid flows from DAC donors, Ireland (current US$)",870000,2280000,1540000,1780000,3150000,6590000,5920000,7040000,6410000,5040000,4260000,4760000,4300000,,
"Net bilateral aid flows from DAC donors, Iceland (current US$)",,,,,,,,,180000,,,,,,
"Net bilateral aid flows from DAC donors, Italy (current US$)",-15580000,-8270000,-20140000,-12540000,-80060000,3490000,2400000,1400000,20230000,15330000,11490000,12470000,4740000,,
"Net bilateral aid flows from DAC donors, Japan (current US$)",368160000,528870000,493640000,325790000,-82050000,71460000,29530000,99890000,599810000,517010000,981140000,796370000,704650000,,
"Net bilateral aid flows from DAC donors, Korea, Rep. (current US$)",140000,450000,430000,1230000,810000,890000,680000,3860000,2500000,750000,1070000,1130000,430000,,
"Net bilateral aid flows from DAC donors, Luxembourg (current US$)",2500000,2910000,1950000,2580000,2190000,2330000,2050000,2960000,3340000,3130000,3700000,3090000,2350000,,
"Net bilateral aid flows from DAC donors, Netherlands (current US$)",-8880000,73480000,59370000,43090000,-315790000,72810000,13050000,6850000,4940000,7210000,2480000,970000,2410000,,
"Net bilateral aid flows from DAC donors, Norway (current US$)",8030000,11600000,8460000,8110000,13200000,28690000,18250000,32670000,34880000,16080000,23990000,29350000,37140000,,
"Net bilateral aid flows from DAC donors, New Zealand (current US$)",960000,1040000,690000,1020000,960000,1700000,940000,1260000,1680000,1910000,360000,880000,380000,,
"Net bilateral aid flows from DAC donors, Portugal (current US$)",240000,780000,240000,,290000,390000,390000,520000,440000,420000,390000,460000,380000,,
"Net bilateral aid flows from DAC donors, Sweden (current US$)",15350000,11200000,8160000,18440000,11580000,16460000,17060000,13490000,12310000,9930000,11000000,12200000,13550000,,
"Net bilateral aid flows from DAC donors, Total (current US$)",710150000,988730000,883040000,446790000,155640000,1051560000,863800000,1003900000,1678590000,1676980000,2313860000,2122080000,1607700000,,
"Net bilateral aid flows from DAC donors, United States (current US$)",14550000,-17310000,-3790000,35980000,50510000,57130000,96840000,84870000,52060000,48120000,57380000,81390000,58090000,,
"PPG, bilateral (AMT, current US$)",1754364000,1861450000,1428989000,2454258000,2014806000,1753771000,1450781000,1196804000,1658685000,1451391000,1502729000,2028708000,1681570000,1686287000,3126683000
"PPG, bilateral concessional (AMT, current US$)",1426017000,1518805000,1108862000,2093508000,1734977000,1542637000,1253227000,1021924000,1449108000,1257195000,1294015000,1782868000,1425638000,1465910000,
"IMF repurchases (AMT, current US$)",25391000,0,0,0,0,0,0,0,0,0,0,0,0,0,
"Principal repayments on external debt, long-term + IMF (AMT, current US$)",6727530000,7333423000,11204527000,20210250000,13062103000,19383512000,12412202000,32096775000,23684613000,10990369000,19017651000,22227261000,21201727000,31227958000,
"Principal repayments on external debt, long-term (AMT, current US$)",6702139000,7333423000,11204527000,20210250000,13062103000,19383512000,12412202000,32096775000,23684613000,10990369000,19017651000,22227261000,21201727000,31227958000,44296071000
"Principal repayments on external debt, private nonguaranteed (PNG) (AMT, current US$)",248633000,2103548000,2384337000,5031339000,5148920000,6914019000,7616540000,23254638000,10237503000,5654139000,13853880000,15404516000,15018541000,18175561000,19707632000
"Principal repayments on external debt, public and publicly guaranteed (PPG) (AMT, current US$)",6453506000,5229875000,8820190000,15178911000,7913183000,12469493000,4795662000,8842137000,13447110000,5336230000,5163771000,6822745000,6183186000,13052397000,
"PPG, IBRD (AMT, current US$)",994089000,723609000,3029734000,3616825000,254968000,210445000,259172000,346179000,389940000,454540000,538766000,640609000,674841000,837940000,
"PPG, IDA (AMT, current US$)",366688000,428749000,455837000,527988000,561903000,606860000,653226000,699874000,764398000,798835000,835108000,893160000,924980000,968344000,
"PPG, multilateral (AMT, current US$)",1739914000,1421547000,5263359000,5850037000,2122748000,946851000,1149019000,1195184000,1342137000,1471478000,1656075000,1878771000,2013739000,2317218000,3867167000
"PPG, multilateral concessional (AMT, current US$)",386848000,441100000,466751000,540244000,574890000,620103000,664058000,712450000,777781000,811905000,850300000,909433000,944838000,991856000,
"PPG, official creditors (AMT, current US$)",3494278000,3282997000,6692348000,8304295000,4137554000,2700622000,2599800000,2391988000,3000822000,2922869000,3158804000,3907479000,3695309000,4003505000,6993850000
"PPG, bonds (AMT, current US$)",0,86000000,142444000,5474375000,2307012000,8456706000,1597000000,5313000000,9467560000,587743000,148391000,200000000,0,5553357000,
"PPG, commercial banks (AMT, current US$)",2736318000,1381348000,1842106000,1337032000,1203977000,1181258000,576946000,1118335000,958515000,1801619000,1837190000,2688908000,2275519000,3486474000,1547654000
"PNG, bonds (AMT, current US$)",35000000,315949000,490295000,332272000,83134000,117296000,56978000,409196000,879549000,1679028000,1851270000,2846787000,3678000000,832627000,
"PNG, commercial banks and other creditors (AMT, current US$)",213633000,1787599000,1894042000,4699067000,5065786000,6796723000,7559562000,22845442000,9357954000,3975111000,12002610000,12557729000,11340541000,17342934000,
"PPG, other private creditors (AMT, current US$)",222910000,479530000,143292000,63209000,264640000,130907000,21916000,18814000,20213000,23999000,19386000,26358000,212358000,9061000,2475000
"PPG, private creditors (AMT, current US$)",2959228000,1946878000,2127842000,6874616000,3775629000,9768871000,2195862000,6450149000,10446288000,2413361000,2004967000,2915266000,2487877000,9048892000,17594589000
"Principal arrears, public and publicly guaranteed (current US$)",0,0,0,0,0,0,0,0,0,0,0,0,0,0,
"Principal arrears, official creditors (current US$)",0,0,0,0,0,0,0,0,0,0,0,0,0,0,
"Principal arrears, private creditors (current US$)",0,0,0,0,0,0,0,0,0,0,0,0,0,0,
Principal forgiven (current US$),0,0,0,0,0,0,0,0,0,0,0,0,0,0,
Principal rescheduled (current US$),0,0,0,0,0,0,0,0,0,0,0,0,0,0,
"Principal rescheduled, official (current US$)",0,0,0,0,0,0,0,0,0,0,0,0,0,0,
"Principal rescheduled, private (current US$)",0,0,0,0,0,0,0,0,0,0,0,0,0,0,
"Commitments, public and publicly guaranteed (COM, current US$)",10706826000,5395478000,4863289000,3233527000,3539724000,3339530000,6801264000,11986287000,8416496000,15175015000,13813484000,19657320000,13809645000,16960672000,
"Commitments, IBRD (COM, current US$)",1495270000,1649000000,1268000000,1076000000,110000000,0,0,2066500000,600000000,5811000000,2033740000,3724000000,420000000,277700000,
"Commitments, IDA (COM, current US$)",748980000,932988000,1050700000,509620000,193400000,0,800455000,1242500000,600000000,1055008000,2314605000,3420040000,1761300000,1110326000,
"Commitments, official creditors (COM, current US$)",3726656000,5195478000,4338298000,3058527000,3178972000,2817717000,4103259000,8075838000,7102609000,13125506000,8384720000,12921050000,9344932000,5959030000,
"Commitments, private creditors (COM, current US$)",6980170000,200000000,524991000,175000000,360752000,521813000,2698005000,3910449000,1313887000,2049509000,5428764000,6736270000,4464713000,11001642000,
"Currency composition of PPG debt, Deutsche mark (%)",4.1972,,,,,,,,,,,,,,
"Currency composition of PPG debt, Euro (%)",,5.8707,6.1194,9.394,7.8438,7.3506,7.0371,6.4879,5.5254,5.0369,3.9846,3.5974,3.0699,3.6275,
"Currency composition of PPG debt, French franc (%)",1.269,,,,,,,,,,,,,,
"Currency composition of PPG debt, Japanese yen (%)",12.6366,11.8726,12.6766,18.2515,18.8771,20.0407,20.2537,19.0979,22.9463,20.3282,19.7841,19.1665,13.9449,11.9848,
"Currency composition of PPG debt, Multiple currencies (%)",9.3543,8.3571,4.1832,2.9824,1.0619,1.0739,0.9023,2.0499,2.2648,2.0528,1.8195,1.7448,0.8238,0.6783,
"Currency composition of PPG debt, all other currencies (%)",0.9062,0.8204,0.768,0.4082,0.4329,0.461,0.3818,0.3197,0.2296,0.2454,0.2101,0.1585,0.3867,0.4375,
"Currency composition of PPG debt, SDR (%)",0.2719,0.2786,0.2978,0.4251,0.6321,1.5096,1.9105,2.0705,2.408,2.902,2.7682,2.8768,2.4487,2.7424,
"Currency composition of PPG debt, Swiss franc (%)",0.3483,0.3742,0.448,0.4383,0.4095,0.3457,0.292,0.2295,0.1811,0.1305,0.0904,0.2246,0.3257,0.3199,
"Currency composition of PPG debt, Pound sterling (%)",3.845,3.7382,3.4496,4.0715,3.8247,3.6601,3.1156,2.4866,2.0984,1.7342,1.3288,1.1124,0.8156,0.7509,
"Currency composition of PPG debt, U.S. dollars (%)",66.2935,68.6882,72.0574,64.029,66.918,65.5584,66.107,67.258,64.3464,67.57,70.0143,71.119,78.1847,79.4587,
Debt forgiveness or reduction (current US$),0,0,0,0,0,0,0,0,0,0,0,0,0,0,
"PPG, bilateral (DIS, current US$)",914923000,1191455000,970890000,1016334000,1116152000,1013312000,990906000,1509077000,2216325000,1813496000,2319762000,2247489000,1978723000,2454935000,4947771000
"PPG, bilateral concessional (DIS, current US$)",711905000,1037780000,804340000,898853000,1084848000,1007520000,977003000,956803000,1591250000,1582222000,2066223000,2011317000,1943079000,2454935000,
"IMF purchases (DIS, current US$)",0,0,0,0,0,0,0,0,0,0,0,0,0,0,
"Disbursements on external debt, long-term + IMF (DIS, current US$)",10556057000,6252991000,8098941000,18690479000,16414132000,19380273000,32443325000,64525981000,38711577000,26645958000,44629135000,44072558000,49929240000,68893553000,
"Disbursements on external debt, long-term (DIS, current US$)",10556057000,6252991000,8098941000,18690479000,16414132000,19380273000,32443325000,64525981000,38711577000,26645958000,44629135000,44072558000,49929240000,68893553000,11593870000
"Disbursements on external debt, private nonguaranteed (PNG) (DIS, current US$)",300000000,2249565000,2658056000,12550082000,8119193000,12750658000,24065723000,48485792000,19887552000,16250301000,19068848000,29207412000,32660667000,56205582000,
"Disbursements on external debt, public and publicly guaranteed (PPG) (DIS, current US$)",10256057000,4003426000,5440885000,6140397000,8294939000,6629615000,8377602000,16040189000,18824025000,10395657000,25560287000,14865146000,17268573000,12687971000,
IDA grants (current US$),0,0,0,0,0,0,0,0,0,0,0,0,0,0,
"PPG, IBRD (DIS, current US$)",706399000,802732000,647319000,684067000,1003789000,863277000,978738000,1002837000,1121509000,1408435000,3333985000,983492000,931642000,840382000,
